<?xml version="1.0" encoding="UTF-8"?>
<root xmlns:xsi="http://www.w3.org/2001/XMLSchema-instance" xsi:noNamespaceSchemaLocation="./template_save.xsd">
  <general>
    <date></date>
    <description></description>
    <bbclic_version></bbclic_version>
  </general>
  <configuration>
    <typologie>
      <comboBox_ListeMaisons></comboBox_ListeMaisons>
      <listeboxSysteme></listeboxSysteme>
      <checkBox_BrasseurAir></checkBox_BrasseurAir>
    </typologie>
    <implantation>
      <listeZoneClimatique></listeZoneClimatique>
      <comboBoxAltitude></comboBoxAltitude>
      <listeZoneDeBruit></listeZoneDeBruit>
      <textBoxSaisieAngle></textBoxSaisieAngle>
    </implantation>
    <parois>
      <modeParoi></modeParoi>
      <listeStructure></listeStructure>
      <listeTypeIsolant></listeTypeIsolant>
      <listeEpaisseurIsolant></listeEpaisseurIsolant>
      <listeCouleurFacade></listeCouleurFacade>
      <valeurRStructure_avance></valeurRStructure_avance>
      <valeurRIsolant_avance></valeurRIsolant_avance>
      <valeurCas_avance></valeurCas_avance>
    </parois>
    <soubassement>
      <modeSoubassement></modeSoubassement>
      <listeSoubassementStructure></listeSoubassementStructure>
      <checkBoxIsolationRefend></checkBoxIsolationRefend>
      <textBoxRSoubassement></textBoxRSoubassement>
      <textBoxPsiPlancherBasRefend></textBoxPsiPlancherBasRefend>
    </soubassement>
    <menuiseries>
      <listeMenuiseriesPerformance></listeMenuiseriesPerformance>
      <comboBoxChoixProtectionSolaire></comboBoxChoixProtectionSolaire>
      <comboBoxModeGestion></comboBoxModeGestion>
      <checkBoxMotorisation></checkBoxMotorisation>
      <checkBoxHorloge></checkBoxHorloge>
      <listeUCoffretVR></listeUCoffretVR>
    </menuiseries>
    <fenetre_toit>
      <comboBoxChoixPMft></comboBoxChoixPMft>
      <comboBoxModeGestionFT></comboBoxModeGestionFT>
      <checkBoxMotorisationFt></checkBoxMotorisationFt>
    </fenetre_toit>
    <plancher_bas>
      <modePlancherBas></modePlancherBas>
      <listePbTypePlancher></listePbTypePlancher>
      <listePbComplementSur></listePbComplementSur>
      <listePbRevetementSol></listePbRevetementSol>
      <listePbJonctionFacade></listePbJonctionFacade>
      <textbox_UplancherBas_avance></textbox_UplancherBas_avance>
      <textbox_Psil_PB_Facade></textbox_Psil_PB_Facade>
    </plancher_bas>
    <plancher_inter>
      <modePlancherInter></modePlancherInter>
      <comboBox_PI_TypePlancher></comboBox_PI_TypePlancher>
      <comboBox_PI_EpaisseurPlancher></comboBox_PI_EpaisseurPlancher>
      <comboBox_PI_RevetementSol></comboBox_PI_RevetementSol>
      <comboBox_PI_JonctionPlancherFacade></comboBox_PI_JonctionPlancherFacade>
      <checkBox_PI_IsolationPeripheriqueFxPlafond></checkBox_PI_IsolationPeripheriqueFxPlafond>
      <textBoxPsilPlancherIntermediaire></textBoxPsilPlancherIntermediaire>
    </plancher_inter>
    <combles>
      <modeToiture></modeToiture>
      <listePhTypeIsolant></listePhTypeIsolant>
      <listePhRIsolant></listePhRIsolant>
      <textbox_RToiture_avance></textbox_RToiture_avance>
      <textbox_PsiPlancherHautFacade_avance></textbox_PsiPlancherHautFacade_avance>
    </combles>
    <toitures-terrasses>
      <checkBox_modeTT></checkBox_modeTT>
      <comboBox_typePlancherTT></comboBox_typePlancherTT>
      <comboBox_epaisseurPlancherTT></comboBox_epaisseurPlancherTT>
      <comboBox_typeIsolationTT></comboBox_typeIsolationTT>
      <comboBox_epaisseurIsolationTT></comboBox_epaisseurIsolationTT>
      <comboBox_TT_JonctionPlancherFacade></comboBox_TT_JonctionPlancherFacade>
      <checkBox_TT_IsolationPeripheriePlafond></checkBox_TT_IsolationPeripheriePlafond>
      <comboBox_couleurTT></comboBox_couleurTT>
      <checkBox_choixVegetalisationTT></checkBox_choixVegetalisationTT>
      <textBox_TT_valeurUp></textBox_TT_valeurUp>
      <textBox_TT_valeurPsil></textBox_TT_valeurPsil>
      <textBox_TT_valeurCAE></textBox_TT_valeurCAE>
      <checkBox_TT_Veget_avance></checkBox_TT_Veget_avance>
      <textBox_TT_valeurSfe></textBox_TT_valeurSfe>
      <textBox_TT_valeurSfc></textBox_TT_valeurSfc>
      <dateTimePicker1></dateTimePicker1>
      <dateTimePicker2></dateTimePicker2>
    </toitures-terrasses>
    <autres>
      <listeParametresTypeCloisonsInterieures></listeParametresTypeCloisonsInterieures>
      <listeParametresPermeabilitéAir></listeParametresPermeabilitéAir>
    </autres>
  </configuration>
  <carbone_manuel>
    <carbone_data parent="saisieCarboneStructureParoi">
      <itemValeurA></itemValeurA>
      <itemValeurB></itemValeurB>
      <itemValeurC></itemValeurC>
      <itemValeurD></itemValeurD>
      <itemValeurE></itemValeurE>
    </carbone_data>
    <carbone_data parent="saisieCarboneIsolationParoi">
      <itemValeurA></itemValeurA>
      <itemValeurB></itemValeurB>
      <itemValeurC></itemValeurC>
      <itemValeurD></itemValeurD>
      <itemValeurE></itemValeurE>
    </carbone_data>
      <carbone_data parent="saisieCarboneStructureSoubassement">
      <itemValeurA></itemValeurA>
      <itemValeurB></itemValeurB>
      <itemValeurC></itemValeurC>
      <itemValeurD></itemValeurD>
      <itemValeurE></itemValeurE>
    </carbone_data>
      <carbone_data parent="saisieCarbonePlancherBas">
      <itemValeurA></itemValeurA>
      <itemValeurB></itemValeurB>
      <itemValeurC></itemValeurC>
      <itemValeurD></itemValeurD>
      <itemValeurE></itemValeurE>
    </carbone_data>
      <carbone_data parent="saisieCarboneIsolationPB">
      <itemValeurA></itemValeurA>
      <itemValeurB></itemValeurB>
      <itemValeurC></itemValeurC>
      <itemValeurD></itemValeurD>
      <itemValeurE></itemValeurE>
    </carbone_data>
      <carbone_data parent="saisieCarboneChapePB">
      <itemValeurA></itemValeurA>
      <itemValeurB></itemValeurB>
      <itemValeurC></itemValeurC>
      <itemValeurD></itemValeurD>
      <itemValeurE></itemValeurE>
    </carbone_data>
      <carbone_data parent="saisieCarboneRevetementPB">
      <itemValeurA></itemValeurA>
      <itemValeurB></itemValeurB>
      <itemValeurC></itemValeurC>
      <itemValeurD></itemValeurD>
      <itemValeurE></itemValeurE>
    </carbone_data>
      <carbone_data parent="saisieCarboneComble">
      <itemValeurA></itemValeurA>
      <itemValeurB></itemValeurB>
      <itemValeurC></itemValeurC>
      <itemValeurD></itemValeurD>
      <itemValeurE></itemValeurE>
    </carbone_data>
  </carbone_manuel>
</root>